object-id,filename,original_filename,report_type,report_number,title,authors,authors_affiliation,contributors,contributors_affiliation,publisher,funder,date,abstract,species,places,concepts,source,language,rights,rightsstatement,format,type
ferl-tr-99-6,ferl-tr-99-6.pdf,1999-06-John-Day-turbine-evaluation-on-CK-SH-1997.pdf,Technical Report,99-6,Evaluation Of Running Turbine 1 At Maximum Capacity On Passage Of Adult Salmon And Steelhead At John Day Dam - 1997,"Bjornn, T.C.; Peery, C.A.; Tolotti, K.R.; Jepson, M.A.",Idaho Cooperative Fish and Wildlife Research Unit,"Stuehrenberg, L.C.","National Marine Fisheries Service, National Oceanic and Atmospheric Administration",University of Idaho,"U.S. Army Corps of Engineers, Portland District; Bonneville Power Administration",1999,"Passage rates and routes of adult Chinook and sockeye salmon and steelhead with radio transmitters were monitored at John Day Dam in 1997 with turbine 1 (south end of powerhouse) operated at two levels (100 and 150 MW ). A split-block experimental design was used to compare where fish approached and entered fishways, and mean and median times for fish to first approach and enter fishways when turbine 1 was operated at either of the two generation levels . Proportions of salmon and steelhead that approached and entered the south-shore fishway entrance and mean and median times for all three species to first approach and first enter fishways did not vary significantly in relation to turbine 1 operation. We conclude that operating turbine 1 at maximum capacity did not significantly affect passage for salmon and stee lhead at John Day Dam in 1997.","Steelhead, Oncorhynchus mykiss; Chinook salmon, Oncorhynchus tshawytscha",Bonneville Dam; John Day Dam; Columbia River; Snake River,salmonids; Federal Columbia River Power System; FCPRS; radiotelemetry; migration; fishways; passage behavior; turbine effects; experimental design,"University of Idaho, Fish Ecology Research Lab",eng,?,?,application/pdf,Text
ferl-tr-99-5,ferl-tr-99-5.pdf,1999-05-John-Day-spill-effects-on-SH-passage-1997.pdf,Technical Report,99-5,"Effects Of Spill In Fall On Passage Of Adult Steelhead At John Day Dam, 1997","Bjornn, T.C.; Peery, C.A.; Tolotti, K.R.",Idaho Cooperative Fish and Wildlife Research Unit,"Stuehrenberg, L.C.","National Marine Fisheries Service, National Oceanic and Atmospheric Administration",University of Idaho,"U.S. Army Corps of Engineers, Portland District; Bonneville Power Administration",1999,"A study was conducted in 1997 to determine the effects of low levels of daytime spill during the early fall on use of the north-shore fishway by steelhead at John Day Dam. Passage of steelhead with transmitters were monitored at the dam during alternating periods with and without daytime spill at the north end of the spillway. We found no significant difference in the proportion of steelhead that first approached and first entered the north-shore entrance (NSE), or eventually passed the dam using the north-shore fishway on days with and without spill. Likewise, median passage times for steelhead to first approach, first enter, and pass the dam using the north-shore fishway were not significantly different with and without spill. Spill levels used during the study averaged 1.7 kcfs, or about 1% of river flow on days with spill, and were insufficient to counter the outflow from the powerhouse near the south shore.","Steelhead, Oncorhynchus mykiss",Columbia River; John Day Dam,salmonids; Federal Columbia River Power System; FCPRS; radiotelemetry; migration; fishways; passage behavior; spill levels; experimental design; vertical-slot weirs,"University of Idaho, Fish Ecology Research Lab",eng,?,?,application/pdf,Text
ferl-tr-99-4,ferl-tr-99-4.pdf,1999-04-John-Day-Shad-effects-on-chinook-psssage-1996.pdf,Technical Report,99-4,Effects Of A Shad Fishery On Passage Of Adult Chinook Salmon Through The Oregon-Shore Fishway Ladder At The Dalles Dam - 1996,"Peery, C.A.; Bjornn, T.C.; Tolotti, K.R.",Idaho Cooperative Fish and Wildlife Research Unit,"Stuehrenberg, L.C.","National Marine Fisheries Service, National Oceanic and Atmospheric Administration",University of Idaho,"U.S. Army Corps of Engineers, Portland District; Bonneville Power Administration",1999,A fishery for American shad Alosa sapidissima at the exit of the Oregon-shore ladder at The Dalles Dam in the spring of 1996 had the potential to disrupt passage of adult Chinook salmon Oncorhynchus tshawytscha through the ladder. We evaluated the effects of the shad fishery on passage by monitoring Chinook salmon with radio transmitters as they passed through the Oregon-shore fishway. Passage times for 54 radio-tagged Chinook salmon that exited the ladder during the period the shad fishery occurred were compared to passage times for 62 radio-tagged Chinook salmon that passed the dam prior to the shad fishery. We found no differences in median times for Chinook salmon to pass through and exit the ladder before and during the shad fishery using this simple comparison.,"American shad, Alosa sapidissima; Chinook salmon, Oncorhynchus tshawytscha",Columbia River; The Dalles Dam,salmonids; clupeids; Federal Columbia River Power System; FCPRS; radiotelemetry; migration; passage behavior; fishways; fisheries effects,"University of Idaho, Fish Ecology Research Lab",eng,?,?,application/pdf,Text
ferl-tr-99-1,ferl-tr-99-1.pdf,1999-01-Fallback-forebay-Bonneville-1997-1998.pdf,Technical Report,99-1,"Radio Telemetry Assessments Of Migration Patterns And Fallbacks Of Adult Salmon And Steelhead In The Forebay Of Bonneville Dam, 1997-1998","Bjornn, T.C.; Reischel, T.S.; Ringe, R.R.; Tolotii, K.R.",Idaho Cooperative Fish and Wildlife Research Unit,"Stuehrenberg, L.C.","National Marine Fisheries Service, National Oceanic and Atmospheric Administration",University of Idaho,"U.S. Army Corps of Engineers, Portland District; Bonneville Power Administration",1999,"Migration routes of adult spring and summer Chinook Oncorhynchus tshawytscha and sockeye salmon O. nerka, and steelhead O. mykiss were monitored in the forebay of Bonneville Dam in 1997 to obtain information that could be used to reduce fallback of adults at the dam. Adult spring and summer Chinook salmon were also radio-tracked in 1998 as a continuation of the 1997 study. In 1996, we determined in the adult passage studies that significant numbers of Chinook salmon fell back over Bonneville Dam, and that most of the fallbacks were fish that had passed the dam via the Bradford Island fishway. In 1997, 991 adult spring and summer Chinook salmon, 577 sockeye salmon, and 975 steelhead were trapped at Bonneville Dam, outfitted with radio transmitters, and released downstream from the dam. In 1998, adult spring/summer (957 fish) and fall Chinook salmon (1022 fish) were trapped, tagged and released downstream from Bonneville Dam, but only a sample of the spring/summer Chinook salmon were tracked in the forebay. As the fish with transmitters reascended the dam and exited the Bradford Island fishway into the forebay, they were followed by boat to determine their route through the forebay of powerhouse I and on upstream. We were particularly interested in routes that led to fallbacks at the dam. Because of high flows in 1997, there was an extended period of forced spill that lasted into July. During the April-July period, 122 spring/summer Chinook salmon, 110 sockeye salmon, and 10 steelhead in 1997, and 129 adult spring/summer Chinook in 1998 were tracked in the forebay of Bonneville Dam.","Steelhead, Oncorhynchus mykiss; Chinook salmon, Oncorhynchus tshawytscha; sockeye salmon, Oncorhynchus nerka",Columbia River; Snake River; Bonneville Dam,salmonids; Federal Columbia River Power System; FCPRS; radiotelemetry; migration; fishways; passage behavior; fallback rates,"University of Idaho, Fish Ecology Research Lab",eng,?,?,application/pdf,Text
ferl-tr-98-5,ferl-tr-98-5.pdf,1998-05-CK-SK-passage-at-Priest Rapids-and-Wanapum-1997.pdf,Technical Report,98-5,Evaluation Of Adult Chinook And Sockeye Salmon Passage At Priest Rapids And Wanapum Dams - 1997,"Peery, C.A.; Bjornn, T.C.; Tolotti, K.R.",Idaho Cooperative Fish and Wildlife Research Unit,,,University of Idaho,"Public Utility of Grant County, Ephrata Washington",1998,"Radio-tagged adult spring and summer Chinook salmon Oncorhynchus tshawytscha and sockeye salmon O. nerka were monitored to evaluate passage conditions at Priest Rapids and Wanapum dams, mid-Columbia River, during 1997. Passage conditions were assessed during two treatment conditions: half the powerhouse orifice gates open and all orifice gates closed. Six travel time variables were analyzed using ANOVA analysis and two non-parametric tests. We concluded that closing orifice gates at Priest Rapids and Wanapum dams did not have a significant effect on passage of Chinook and sockeye salmon in 1997. Chinook and sockeye salmon passed through the Hanford Reach section of the Columbia River in 2 to 3 d. Of 217 Chinook salmon that reached Priest Rapids Dam, 199 eventually passed the dam, in 37.6 h, and reached Wanapum Dam. One hundred and ninety Chinook salmon are known to have crossed Wanapum Dam in 20.1 h. Of 440 sockeye salmon that reached Priest Rapids Dam, 427 eventually crossed the dam, in 18.6 h, and reached Wanapum Dam. Four hundred and nine sockeye salmon are known to have crossed Wanapum Dam in 29.7 h. A prototype fishway fence installed inside the west-powerhouse entrance (Lew2) at Priest Rapids Dam was not effective at reducing the number of salmon that exited from the fishway at that point. Salmon were not held up at the fish counting station in the east-shore ladder at Priest Rapids Dam. However, passage times were about three times longer to pass the coded-wire-tag trap near the top of the ladder when the trap was operating as compared to the same section of ladder when the trap was not operating, resulting in median delays 42 min for Chinook salmon and 2.1 h for sockeye salmon. Salmon used the new vertical-slot gate placed at the west-shore fishway entrance (Rew2) as readily as the two other main entrances (Se2 and Se3) at Wanapum Dam. Six (3.0%) Chinook salmon and 16 (3.9%) sockeye salmon fell back at Priest Rapids Dam. Five Chinook salmon and 15 sockeye salmon eventually re-crossed Priest Rapids Dam after an average delay of about 26 h. Eight (4.1%) Chinook salmon and 19 (4.5%) sockeye salmon fell back at Wanapum Dam. Seven Chinook salmon and 12 sockeye salmon eventually re-crossed Wanapum Dam after average delays of about 42 to 48 h.","Chinook salmon, Oncorhynchus tshawytscha; sockeye salmon, Oncorhynchus nerka",Columbia River; Priest Rapids Dam; Wanapum Dam,salmonids; Federal Columbia River Power System; FCPRS; radiotelemetry; migration; fishways; passage behavior; fallback rates,"University of Idaho, Fish Ecology Research Lab",eng,?,?,application/pdf,Text
ferl-tr-1996-01,ferl-tr-1996-01.pdf,1996-01-CK-passage-at-Priest Rapids-1996.pdf,Technical Report,1996-01,Evaluation Of Adult Chinook Salmon Passage At Priest Rapids Dam With Orifice Gates Open And Closed,"Bjornn, T.C.; Jepson, M.A.; Peery, C.A.; Tolotti, K.R.",Idaho Cooperative Fish and Wildlife Research Unit,,,University of Idaho,"Public Utility District of Grant County
Ephrata, Washington",1996,"Radio-tagged adult spring and summer Chinook salmon were monitored to evaluate passage condition at Priest Rapids Dam, mid-Columbia River, during 1996. Passage times were assessed during two treatment conditions: half the powerhouse orifice gates open and all orifice gates closed. Travel times from first record in the tailrace to first approach at the dam, to first entry into the fishway, first entry to the junction pool, and to pass the dam were not significantly different with respect to orifice gate closure. Of 119 radio-tagged Chinook salmon monitored at Priest Rapids Dam, 115 salmon eventually crossed the dam. Salmon entered the fishway collection channel mainly at the east-shore and west-powerhouse entrances. There were more entries than exits at the east entrance, but more exits than entries at the west-powerhouse openings. Half the radio-tagged Chinook salmon passed Priest Rapids Dam in less than 37.6 h. About one-third of time to pass the dam was associated with movements in and out of the junction pool area. After entering the junction pool for the first time, most (79%) fish returned to the collection channel and then exited and re-entered the fishway an average of 6.5 times before successfully crossing the dam. Six fish fell back over the dam during this study, for a fallback rate of 5.2%. Four fish re-ascended the dam in an average of 9.8 days.","Chinook salmon, Oncorhynchus tshawytscha",Columbia River; Priest Rapids Dam,salmonids; Federal Columbia River Power System; FCPRS; radiotelemetry; migration; fishways; passage behavior; fallback rates,"University of Idaho, Fish Ecology Research Lab",eng,?,?,application/pdf,Text
ferl-tr-2017-2,ferl-tr-2017-2.pdf,UI Adult Salmon and Steelhead Synthesis.pdf,Technical Report,2017-2,"Migration Of Adult Salmonids In The Federal Columbia River Hydrosystem: A Summary Of Radiotelemetry Studies, 1996-2014","Keefer, M.L.; Jepson, M.A.; Clabough, T.S.; Caudill, C.C.",Idaho Cooperative Fish and Wildlife Research Unit,"Bjornn, T.C.; Burke, B.J.; Caudill, C.C.; Frick, K.; Matter, A.L.; Moser, M.L.; Peery, C.A.; Stuehrenberg, L.C.","Idaho Cooperative Fish and Wildlife Research Unit; National Marine Fisheries Service, National Oceanic and Atmospheric Administration",University of Idaho,"U.S. Army Corps of Engineers, Portland District",2017,"Radiotelemetry has been used by University of Idaho and research partners to study migration and dam passage behavior of adult salmon and steelhead in the Federal Columbia River Power System (FCRPS) since the 1990s. During fifteen return years in the period 1996-2014, more than 26,800 adult salmonids were tagged at Bonneville Dam and monitored as they migrated through the FCRPS and into tributaries. Monitoring varied through time in response to evolving study objectives and there is an extensive series of technical reports and peer-reviewed papers that have summarized annual and multi-year study results. However, there has not been a single-source compilation of the data, methods, and results across the nearly two-decade time series.
This document and supporting appendices and databases address four primary objectives: Metadata: Document radiotelemetry metadata, including antenna deployment sites, fish handling and tagging protocols, and telemetry data processing and quality control procedures; 
Database Delivery: Compile and standardize all data associated with the radio-tagged fish, including filtered (i.e., ‘coded’) radiotelemetry and PIT-tag detection histories into a master database for each species and run; 
Bibliography: Provide a bibliography and key-word index of technical reports and peer- reviewed papers associated with the radiotelemetry studies to expedite researcher and manager access to existing results; 
FCRPS Adult Passage Metrics: Generate selected adult salmon and steelhead passage behavior and passage performance metrics for all study years and species at eight FCRPS projects: Bonneville, The Dalles, John Day, McNary, Ice Harbor, Lower Monumental, and Lower Granite dams.","Steelhead, Oncorhynchus mykiss; Chinook salmon, Oncorhynchus tshawytscha; sockeye salmon, Oncorhynchus nerka",,,"University of Idaho, Fish Ecology Research Lab",eng,?,?,application/pdf,Text
ferl-lr-2015-09-24,ferl-lr-2015-09-24.pdf,2015 LR 24Sep15 TD14SH spill test.pdf,Letter Report,2015-9,"Behavior of radio-tagged adult steelhead before, during, and after the spill test at The Dalles Dam in September 2014",Jepson; Keefer; Caudill,Idaho Cooperative Fish and Wildlife Research Unit,,,University of Idaho,,2015-09-24,,,,,"University of Idaho, Fish Ecology Research Lab",eng,?,?,application/pdf,Text
ferl-lr-2011-12-15,ferl-lr-2011-12-15.pdf,2011 LR 15Dec11 UI-FWS  expanded thermal refugia report..pdf,Letter Report,2011-07-05b,Temperature regimes during upstream migration and use of thermal refugia by adult salmon and steelhead in the Columbia River basin,Keefer; Caudill,Idaho Cooperative Fish and Wildlife Research Unit,,,University of Idaho,,2011-12-15,,,,,"University of Idaho, Fish Ecology Research Lab",eng,?,?,application/pdf,Text
ferl-lr-2011-01-12,ferl-lr-2011-01-12.pdf,2011 LR 12Jan11 MN CK Tilt Weir summary13Jan11 to DF.pdf,Letter Report,2011-07-05a,"Use of floating orifice gate fishway entrances by adult Chinook salmon, steelhead, sockeye salmon and Pacific lamprey at Bonneville Dam",Keefer,Idaho Cooperative Fish and Wildlife Research Unit,,,University of Idaho,,2011-01-12,,,,,"University of Idaho, Fish Ecology Research Lab",eng,?,?,application/pdf,Text
ferl-lr-2011-07-05,ferl-lr-2011-07-05.pdf,2011 LR 05Jul11 UI Bonneville Floating Orifice Gate letter report July 2011.pdf,Letter Report,2011-01-12,Preliminary evaluation of radio-telemetry data for Chinook salmon at McNary Dam – 2010,Jepson; Caudill; Keefer; Burke,Idaho Cooperative Fish and Wildlife Research Unit,,,University of Idaho,,2011-07-05,,,,,"University of Idaho, Fish Ecology Research Lab",eng,?,?,application/pdf,Text
ferl-lr-2010-02-11,ferl-lr-2010-02-11.pdf,2010 LR 11Feb10 UI LM09CK Radiodata vs Counts report 11Feb10.pdf,Letter Report,2010-05-06,Temperature regimes during upstream migration and the use of thermal refugia by adult salmon and steelhead in the Columbia River basin,Keefer; Caudill; Peery,Idaho Cooperative Fish and Wildlife Research Unit,,,University of Idaho,,2010-02-11,,,,,"University of Idaho, Fish Ecology Research Lab",eng,?,?,application/pdf,Text
ferl-lr-2010-03-10,ferl-lr-2010-03-10.pdf,2010 LR 10Mar10 UI UMT channel summary 10 March 2010 (2).pdf,Letter Report,2010-03-10,Adult Chinook salmon and Pacific lamprey behavior in Bonneville’s UMT channel,Keefer; Caudill,Idaho Cooperative Fish and Wildlife Research Unit,,,University of Idaho,,2010-03-10,,,,,"University of Idaho, Fish Ecology Research Lab",eng,?,?,application/pdf,Text
ferl-lr-2010-05-06,ferl-lr-2010-05-06.pdf,2010 LR 06May10 UI-FWS  expanded thermal refugia report 15Dec2011.pdf,Letter Report,2010-02-11,Evaluation of passage and fallback events by radio-tagged Chinook salmon at Ice Harbor and Lower Monumental Dams as they relate to fish count discrepancies -2009,Jepson; Keefer; Caudill,Idaho Cooperative Fish and Wildlife Research Unit,,,University of Idaho,,2010-05-06,,,,,"University of Idaho, Fish Ecology Research Lab",eng,?,?,application/pdf,Text
ferl-lr-2009-06-29,ferl-lr-2009-06-29.pdf,2009 LR 29Jun09 UI BO09 spring CK Interim report 1Jul09.pdf,Letter Report,2009-11-24,Evaluation of radio-tagged adult Chinook salmon behavior in response to nighttime flow reductions at McNary Dam - 2009,Jepson; Clabough; Caudill,Idaho Cooperative Fish and Wildlife Research Unit,,,University of Idaho,,2009-06-29,,,,,"University of Idaho, Fish Ecology Research Lab",eng,?,?,application/pdf,Text
ferl-lr-2009-11-24,ferl-lr-2009-11-24.pdf,2009 LR 24Nov09 UI Letter Report - MN nightime flow affects on CK 24Nov09.pdf,Letter Report,2009-09-22,Preliminary evaluation of radio-telemetry data for June-tagged Chinook salmon at Bonneville Dam - 2009,Keefer; Jepson; Caudill; Burke,Idaho Cooperative Fish and Wildlife Research Unit,,,University of Idaho,,2009-11-24,,,,,"University of Idaho, Fish Ecology Research Lab",eng,?,?,application/pdf,Text
ferl-lr-2009-09-22,ferl-lr-2009-09-22.pdf,2009 LR 22Sep09 UI BO09 summer CK Interim report 22Sep09.pdf,Letter Report,2009-06-29,Preliminary evaluation of radio-telemetry data for Spring Chinook salmon at Bonneville Dam - 2009,Keefer; Jepson; Caudill; Burke,Idaho Cooperative Fish and Wildlife Research Unit,,,University of Idaho,,2009-09-22,,,,,"University of Idaho, Fish Ecology Research Lab",eng,?,?,application/pdf,Text
ferl-lr-2008-10-06,ferl-lr-2008-10-06.pdf,2008 LR 6Oct08 Tucannon letter report.pdf,Letter Report,2008-10-06,Behavior of radio-tagged Chinook salmon and steelhead associated with the Tucannon River,Keefer; Caudill,Idaho Cooperative Fish and Wildlife Research Unit,,,University of Idaho,,2008-10-06,,,,,"University of Idaho, Fish Ecology Research Lab",eng,?,?,application/pdf,Text
ferl-lr-2008-04-02,ferl-lr-2008-04-02.pdf,2008 LR 2Apr08 Upper Salmon Chinook timing (UI).pdf,Letter Report,2008-04-18,Summary of available information on straying of Snake River steelhead in the Columbia River,Peery,Idaho Cooperative Fish and Wildlife Research Unit,,,University of Idaho,,2008-04-02,,,,,"University of Idaho, Fish Ecology Research Lab",eng,?,?,application/pdf,Text
ferl-lr-2008-04-18,ferl-lr-2008-04-18.pdf,2008 LR 18Apr08 Snake River Steelhead Straying_21Apr08.pdf,Letter Report,2008-04-02,Migration timing of upper Salmon River spring-summer Chinook stocks,Keefer; Peery,Idaho Cooperative Fish and Wildlife Research Unit,,,University of Idaho,,2008-04-18,,,,,"University of Idaho, Fish Ecology Research Lab",eng,?,?,application/pdf,Text
ferl-lr-2007-05-31,ferl-lr-2007-05-31.pdf,2007 LR 31May07 LM-GO passage for radiotagged CK (UI).pdf,Letter Report,2007-10-18,Radio-telemetry data for Chinook salmon at Bonneville Dam - 2007,"Jepson, Tolotti; Peery; Burke",Idaho Cooperative Fish and Wildlife Research Unit,,,University of Idaho,,2007-05-31,,,,,"University of Idaho, Fish Ecology Research Lab",eng,?,?,application/pdf,Text
ferl-lr-2007-09-24,ferl-lr-2007-09-24.pdf,2007 LR 24Sep07 Pinniped impacts.pdf,Letter Report,2007-10-12,Preliminary summary of the Bonneville adult trap operation on ladder passage times,Keefer; Peery,Idaho Cooperative Fish and Wildlife Research Unit,,,University of Idaho,,2007-09-24,,,,,"University of Idaho, Fish Ecology Research Lab",eng,?,?,application/pdf,Text
ferl-lr-2007-10-18,ferl-lr-2007-10-18.pdf,2007 LR 18Oct07 UI 07 Radio Report BO_18Oct07.pdf,Letter Report,2007-09-24,Estimates of pinniped predation at Bonneville Dam on specific Chinook salmon stocks,Keefer; Peery,Idaho Cooperative Fish and Wildlife Research Unit,,,University of Idaho,,2007-10-18,,,,,"University of Idaho, Fish Ecology Research Lab",eng,?,?,application/pdf,Text
ferl-lr-2007-01-16,ferl-lr-2007-01-16.pdf,2007 LR 16Jan07 Steelhead fallback at TD in November.pdf,Letter Report,2007-06-13,Evaluation of the effects of the shad fishery on passage of adult Chinook salmon at The Dalles Dam,Univ. of Idaho,Idaho Cooperative Fish and Wildlife Research Unit,,,University of Idaho,,2007-01-16,,,,,"University of Idaho, Fish Ecology Research Lab",eng,?,?,application/pdf,Text
ferl-lr-2007-06-13,ferl-lr-2007-06-13.pdf,2007 LR 13Jun07 East TOL Trap Eval.pdf,Letter Report,2007-06-04,Behavior of radio-tagged adult spring Chinook at The Dalles Dam - 2007,Jepson,Idaho Cooperative Fish and Wildlife Research Unit,,,University of Idaho,,2007-06-13,,,,,"University of Idaho, Fish Ecology Research Lab",eng,?,?,application/pdf,Text
ferl-lr-2007-10-12,ferl-lr-2007-10-12.pdf,2007 LR 12Oct 07 BOT effects.pdf,Letter Report,2007-05-31,"Spring-summer Chinook passage between Lower Monumental and Little Goose, 2004-2005",Keefer; Peery,Idaho Cooperative Fish and Wildlife Research Unit,,,University of Idaho,,2007-10-12,,,,,"University of Idaho, Fish Ecology Research Lab",eng,?,?,application/pdf,Text
ferl-lr-2007-06-04,ferl-lr-2007-06-04.pdf,2007 LR 04Jun07TD Spill Eval.pdf,Letter Report,2007-01-16,Summary of steelhead fallback during November at The Dalles Dam,Keefer; Peery,Idaho Cooperative Fish and Wildlife Research Unit,,,University of Idaho,,2007-06-04,,,,,"University of Idaho, Fish Ecology Research Lab",eng,?,?,application/pdf,Text
ferl-lr-2006-07-26,ferl-lr-2006-07-26.pdf,2006 LR 26Jul06 Steelhead Fallback via B1 and B2 Turbines.pdf,Letter Report,2006-08-15,"2001 & 2002 Fallback information at The Dalles, John Day dams",Peery; Boggs,Idaho Cooperative Fish and Wildlife Research Unit,,,University of Idaho,,2006-07-26,,,,,"University of Idaho, Fish Ecology Research Lab",eng,?,?,application/pdf,Text
ferl-lr-2006-01-24a,ferl-lr-2006-01-24a.pdf,2006 LR 24Jan06 2004 Adult straying summary.pdf,Letter Report,2006-07-26,Fall Chinook and steelhead fallback via B1 and B2 turbines; 2002-2004,Boggs; Peery,Idaho Cooperative Fish and Wildlife Research Unit,,,University of Idaho,,2006-01-24,,,,,"University of Idaho, Fish Ecology Research Lab",eng,?,?,application/pdf,Text
ferl-lr-2006-01-24b,ferl-lr-2006-01-24b.pdf,2006 LR 24Jan06 2003-2004 Adult escapement.pdf,Letter Report,2006-06-22,Ad hoc summary of migration times from ladder top at Bonneville Dam to ladder top at The Dalles Dam or the tailrace of John Day Dam for radiotagged adult spring-summer Chinook salmon,Jepson; Peery,Idaho Cooperative Fish and Wildlife Research Unit,,,University of Idaho,,2006-01-24,,,,,"University of Idaho, Fish Ecology Research Lab",eng,?,?,application/pdf,Text
ferl-lr-2006-06-22,ferl-lr-2006-06-22.pdf,2006 LR 22Jun06TD Northladder final.pdf,Letter Report,2006-06-06,"Summary of the use of orifice gates at Bonneville Dam by adult Chinook salmon, sockeye salmon, and steelhead: 1997-1998",Keefer; Peery,Idaho Cooperative Fish and Wildlife Research Unit,,,University of Idaho,,2006-06-22,,,,,"University of Idaho, Fish Ecology Research Lab",eng,?,?,application/pdf,Text
ferl-lr-2006-01-19,ferl-lr-2006-01-19.pdf,2006 LR 19Jan06 Esc above Granite (steelhead).pdf,Letter Report,2006-01-24b,Summary of 2004 straying rates for known-origin Chinook salmon and steelhead in the Columbia/Snake hydrosystem,Keefer; Peery,Idaho Cooperative Fish and Wildlife Research Unit,,,University of Idaho,,2006-01-19,,,,,"University of Idaho, Fish Ecology Research Lab",eng,?,?,application/pdf,Text
