object-id,filename,original_filename,report_type,report_number,title,authors,authors_affiliation,contributors,contributors_affiliation,publisher,funder,date,abstract,species,places,concepts,source,language,rights,rightsstatement,format,type
ferl-tr-2004-4,ferl-tr-2004-4.pdf,2004-04-CK-SH-fallback-at-Bonneville-2000-2001.pdf,Technical Report,2004-4,"Adult Chinook Salmon And Steelhead Fallback At Bonneville Dam, 2000-2001","Boggs, C.T.; Keefer, M.L.; Peery, C.A.",Idaho Cooperative Fish and Wildlife Research Unit,"Moser, M.L.","National Marine Fisheries Service, National Oceanic and Atmospheric Administration",University of Idaho,"U.S. Army Corps of Engineers, Portland District; U.S. Army Corps of Engineers, Walla Walla District",2004,"In 2000 and 2001, we outfitted adult Chinook salmon Onchorhynchus tshawytscha and steelhead O. mykiss with radio transmitters at Bonneville Dam to monitor their survival and passage at the dams on the Columbia and Snake rivers and their survival to natal streams. This report presents information on the percentage of salmon and steelhead that fell back at Bonneville Dam, fallback rates, the relationship of fallback to environmental variables, final distribution and survival of fish that fell back, stock-specific fallback proportions and bias in escapement estimates based on counts of fish at dams.","Steelhead, Oncorhynchus mykiss; Chinook salmon, Oncorhynchus tshawytscha",Bonneville Dam; Columbia River; Snake River,salmonids; Federal Columbia River Power System; FCPRS; radiotelemetry; migration; passage behavior; fishways; fallback rates,"University of Idaho, Fish Ecology Research Lab",eng,?,?,application/pdf,Text
ferl-tr-2004-3,ferl-tr-2004-3.pdf,2004-03-CK-SH-juvenile-bypass-fallback-2000-2001.pdf,Technical Report,2004-3,"Evaluation Of Fallback Of Adult Salmon And Steelhead Via Juvenile Bypass Systems At Bonneville, John Day, Mcnary And Ice Harbor Dams: 2000-2001","Jepson, M.A.; Bjornn, T.C.; Peery, C.A.; Keefer, M.L.; Tolotti, K.R.",Idaho Cooperative Fish and Wildlife Research Unit,"Moser, M.L.","Northwest Fisheries Center, National Marine Fisheries Service, National Oceanic and Atmospheric Administration",University of Idaho,"U.S. Army Corps of Engineers, Portland District; U.S. Army Corps of Engineers, Walla Walla District",2004,"We used radiotelemetry techniques to assess the fallback behavior of adult spring, summer, and fall Chinook salmon and steelhead via juvenile bypass systems (JBS) at Bonneville, John Day, McNary, and Ice Harbor dams in 2000 and 2001. Of the 868 fallback events recorded at the four dams during the two study years, 77 (8.9%) were via a JBS; 22 by spring-summer Chinook salmon, four by fall Chinook salmon, and 51 by steelhead. Sixty-one percent of all JBS fallback events occurred in 2001. Fifty-six percent of them occurred at McNary Dam. The median JBS residency time was 10.4 h based on minimum estimates and 60.2 h based on maximum estimates.","Steelhead, Oncorhynchus mykiss; Chinook salmon, Oncorhynchus tshawytscha",Bonneville Dam; John Day Dam; McNary Dam; Ice Harbor Dam; Columbia River; Snake River,salmonids; Federal Columbia River Power System; FCPRS; radiotelemetry; migration; passage behavior; fishways; fallback rates; juvenile bypass systems; JBS,"University of Idaho, Fish Ecology Research Lab",eng,?,?,application/pdf,Text
ferl-tr-2004-2,ferl-tr-2004-2.pdf,2004-02-CK-SH-behavior-count-windows-slot-weirs-Bonneville-2001-2002.pdf,Technical Report,2004-2,An Evaluation Of Adult Chinook Salmon And Steelhead Behavior At Counting Windows And Through Vertical-Slot Weirs Of Bonneville Dam Using Radiotelemetry: 2001-2002,"Jepson, M.A.; Nauman, C.M.; Peery, C.A.; Tolotti, K.R.",Idaho Cooperative Fish and Wildlife Research Unit,"Moser, M.L.","Northwest Fisheries Center, National Marine Fisheries Service, National Oceanic and Atmospheric Administration",University of Idaho,"U.S. Army Corps of Engineers, Portland District; U.S. Army Corps of Engineers, Walla Walla District",2004,"We used radio telemetry to evaluate the behavior of spring–summer Chinook salmon, fall Chinook salmon, and steelhead swimming past counting windows and through vertical-slot weirs of the Bradford Island and Washington shore fishways at Bonneville Dam during 2001 and 2002.  Median times to pass a counting window ranged from 2.0 to14.7 min among all run/year/fishway groups (n=12) and were consistently highest for run/year groups initially recorded at the Bradford Island counting window. Ratios of counting window passage times to total dam passage times (first record in tailrace to last record at ladder exit) for individual fish were ≤ 1.0% based on median values, and ≤6.7% based on mean values, of all year/run/fishway groups. The maximum proportion of fish swimming downstream to a transition pool after being recorded at a counting window was for spring–summer Chinook salmon at the Bradford Island counting window in 2001 (2.4%, n=340). The median counting window passage times for all fish that swam to a transition pool after being detected at a counting window was approximately 30 h (n=24).","Steelhead, Oncorhynchus mykiss; Chinook salmon, Oncorhynchus tshawytscha",Bonneville Dam; Columbia River; Snake River,salmonids; Federal Columbia River Power System; FCPRS; radiotelemetry; migration; passage behavior; fishways; counting windows; vertical-slot weirs,"University of Idaho, Fish Ecology Research Lab",eng,?,?,application/pdf,Text
ferl-tr-2003-6_draft,ferl-tr-2003-6_draft.pdf,2003-06-FC-thermal-refuge-migration-draft-1998&2000.pdf,Technical Report,2003-6 Draft,"Temperature Influenced Migratory Behavior And Use Of Thermal Refuges By Upriver Bright Fall Chinook Salmon, 1998 And 2000","Goniea, T.M.; Peery, C.A.; Bennett, D.H.",Idaho Cooperative Fish and Wildlife Research Unit,,,University of Idaho,"U.S. Army Corps of Engineers, Portland District; U.S. Army Corps of Engineers, Walla Walla District; Bonneville Power Administration",2003,"Correlations between lower Columbia River water temperatures and run timing, migration behavior, and tributary use by fall Chinook salmon Oncorhynchus tshawytscha were studied using historic counts and radio telemetry data. Over the past 70 years, mean August and September water temperatures recorded at Bonneville Dam have increased, often exceeding the estimated optimal migration temperature for fall Chinook salmon. We found median run passage dates from historic fall chinook count data at Bonneville, The Dalles and McNary dams were positively correlated with mean August water temperatures at Bonneville Dam, suggesting later adult migration timing in warm years.","Chinook salmon, Oncorhynchus tshawytscha",Bonneville Dam; Columbia River; Snake River; The Dalles; John Day Dam; McNary Dam,salmonids; Federal Columbia River Power System; FCPRS; radiotelemetry; migration; stream temperature; straying behavior; escapement,"University of Idaho, Fish Ecology Research Lab",eng,?,?,application/pdf,Text
ferl-tr-2003-5,ferl-tr-2003-5.pdf,2003-05-CK-fishways-and-transition-pools-1996.pdf,Technical Report,2003-5,"Adult Spring And Summer Chinook Salmon Passage Through Fishways And Transition Pools At Bonneville, Mcnary, Ice Harbor, And Lower Granite Dams, 1996","Keefer, M.L.; Bjornn, T.C.; Peery, C.A.; Tolotti, K.R.; Ringe, R.R.",Idaho Cooperative Fish and Wildlife Research Unit,"Stuehrenberg, L.C.","National Marine Fisheries Service, National Oceanic and Atmospheric Administration",University of Idaho,"U.S. Army Corps of Engineers, Portland District; U.S. Army Corps of Engineers, Walla Walla District; Bonneville Power Administration",2003,"Evaluation of fishway entrances used, and passage through the fishways by Chinook salmon Oncorhynchus tshawytscha and steelhead O. mykiss at dams in the lower Columbia and Snake rivers was an objective of the adult salmon and steelhead passage project. In 1996, we monitored passage through the fishways by outfitting Chinook salmon with radio transmitters and installing full antenna/receiver coverage at Bonneville, McNary, Ice Harbor, and Lower Granite dams. Critical parameters studied were times for a fish to first approach the dam and first enter a fishway, total time to pass over the dam, which entrances were approached, where fish entered and exited the fishways, and their passage through transition pools and over the dams.","Steelhead, Oncorhynchus mykiss; Chinook salmon, Oncorhynchus tshawytscha",Bonneville Dam; Columbia River; Snake River; Lower Granite Dam; The Dalles Dam; John Day Dam; McNary Dam; Ice Harbor Dam; Lower Monumental Dam; Little Goose Dam,salmonids; Federal Columbia River Power System; FCPRS; radiotelemetry; migration; passage behavior; fishways; counting windows; transition pools,"University of Idaho, Fish Ecology Research Lab",eng,?,?,application/pdf,Text
ferl-tr-2003-04,ferl-tr-2003-04.pdf,2003-04-Shad-effects-at-The-Dalles-2002.pdf,Technical Report,2003-04,Effects Of The Shad Fishery On Passage Of Adult Chinook Salmon Through The Oregon-Shore Fishway Ladder At The Dalles Dam – 2002,"Jepson, M.A.; Williams, C.L.; Peery, C.A.",Idaho Cooperative Fish and Wildlife Research Unit,"Moser, M.L.","National Marine Fisheries Service, National Oceanic and Atmospheric Administration",University of Idaho,"U.S. Army Corps of Engineers, Portland District; U.S. Army Corps of Engineers, Walla Walla District",2003,"A fishery for American shad Alosa sapidissima at the exit of the Oregon-shore ladder at The Dalles Dam in the spring of 2002 had the potential to disrupt passage of adult Chinook salmon Oncorhynchus tshawytscha through the ladder. We evaluated the effects of the shad fishery on passage by monitoring Chinook salmon with radio transmitters as they passed through the Oregon-shore fishway. Passage times for 33 radio-tagged Chinook salmon that exited the ladder during the period the shad fishery were compared to passage times for 60 radio-tagged Chinook salmon that passed the dam prior to the shad fishery. We found that median time for Chinook salmon to pass through and exit the ladder before the shad fishery was significantly shorter than the median passage time observed during the shad fishery. However, the median time for Chinook salmon to pass on fishery days when the trapnet was deployed was not significantly different from the median time observed on fishery days when the trapnet was not deployed. Similarly, the effect of the fishery on passage rates was confounded with cooler mean daily water temperatures observed in the forebay of the dam during the fishery.","American shad, Alosa sapidissima; Chinook salmon, Oncorhynchus tshawytscha",Columbia River; The Dalles Dam,salmonids; clupeids; Federal Columbia River Power System; FCPRS; radiotelemetry; migration; passage behavior; fishways; fisheries effects,"University of Idaho, Fish Ecology Research Lab",eng,?,?,application/pdf,Text
ferl-tr-2003-2,ferl-tr-2003-2.pdf,2003-02-Snake-River-Tempeature-Report.pdf,Technical Report,2003-2,Water Temperatures And Passage Of Adult Salmon And Steelhead In The Lower Snake River,"Peery, C.A.; Bjornn, T.C.",Idaho Cooperative Fish and Wildlife Research Unit,"Stuehrenberg, L.C.","National Marine Fisheries Service, National Oceanic and Atmospheric Administration",University of Idaho,"U.S. Army Corps of Engineers, Walla Walla District",2003,"We used recently collected and historic data to evaluate effects of water temperatures on passage of adult salmon and steelhead in the lower Snake River, especially in relation to temperature exposures in fishways. Similar to the findings of others, we found little evidence that water temperatures have increased over time at the mouth of the Snake River (downstream from Ice Harbor Dam) but temperatures in the forebay of Ice Harbor Dam have trended upwards in the fall (September and October) since 1962. The latter trend can be explained at least in part by an increase in air temperatures during August and September in the region since 1948.","Steelhead, Oncorhynchus mykiss; Chinook salmon, Oncorhynchus tshawytscha",Columbia River; Snake River; Ice Harbor Dam; Lower Granite Dam,salmonids; Federal Columbia River Power System; FCPRS; radiotelemetry; migration; stream temperature; fishways; tailraces; forebays; passage behavior,"University of Idaho, Fish Ecology Research Lab",eng,?,?,application/pdf,Text
ferl-tr-2003-1,ferl-tr-2003-1.pdf,2003-01-CK-FC-SK-SH-passage-in-relation-to-fishway-temperatures-John-Day-1997-1998.pdf,Technical Report,2003-1,Passage Of Radio-Tagged Adult Salmon And Steelhead At John Day Dam With Emphasis On Fishway Temperatures: 1997-1998,"Keefer, M.L.; Peery, C.A.",Idaho Cooperative Fish and Wildlife Research Unit,"Burke, B.","National Marine Fisheries Service, National Oceanic and Atmospheric Administration",University of Idaho,"U.S. Army Corps of Engineers, Portland District; U.S. Army Corps of Engineers, Walla Walla District",2003,"To better understand the effects of elevated fishway temperatures at John Day Dam on passage of adult salmonids, we examined and compared behavior of radio-tagged adult Chinook salmon, sockeye salmon and steelhead at both John Day and The Dalles dams in 1997 and 1998. We calculated passage times through tailraces, fishways, transition pools and ladders and overall dam passage times, as well as the proportions of each run that exited fishways into tailrace areas and fishway exit rates.","Steelhead, Oncorhynchus mykiss; Chinook salmon, Oncorhynchus tshawytscha; sockeye salmon, Oncorhynchus nerka",John Day Dam; The Dalles Dam; Columbia River,salmonids; Federal Columbia River Power System; FCPRS; radiotelemetry; migration; stream temperature; fishways; tailraces; transition pools; passage behavior; exit rates,"University of Idaho, Fish Ecology Research Lab",eng,?,?,application/pdf,Text
ferl-tr-2002-2,ferl-tr-2002-2.pdf,2002-02-SH-general-migration-1996.pdf,Technical Report,2002-2,"Migration Of Adult Steelhead Past Columbia And Snake River Dams, Through Reservoirs And Distribution Into Tributaries, 1996","Keefer, M.L.; Bjornn, T.C.; Peery, C.A.; Tolotti, K.R.; Ringe, R.R.; Keniry, P.J.",Idaho Cooperative Fish and Wildlife Research Unit,"Stuehrenberg, L.C.","National Marine Fisheries Service, National Oceanic and Atmospheric Administration",University of Idaho,"U.S. Army Corps of Engineers, Portland District; U.S. Army Corps of Engineers, Walla Walla District; Bonneville Power Administration",2002,"We captured 770 steelhead Oncorhynchus mykiss in the adult trapping facility at Bonneville Dam in 1996, released them with radio transmitters, and studied their passage past dams, through reservoirs and into tributaries. Radio receivers were set up at Columbia and Snake River dams and at the mouths of major tributaries to monitor movements of steelhead. Recaptures of steelhead at hatcheries, weirs and traps, and data from mobile tracking were used to complete the migration history.","Steelhead, Oncorhynchus mykiss; Chinook salmon, Oncorhynchus tshawytscha",Ice Harbor Dam; John Day Dam; Columbia River; Snake River; Bonneville Dam,salmonids; Federal Columbia River Power System; FCPRS; radiotelemetry; migration; fishways; transition pools; passage behavior,"University of Idaho, Fish Ecology Research Lab",eng,?,?,application/pdf,Text
ferl-tr-2001-3,ferl-tr-2001-3.pdf,2001-03-CK-SH-Fallback-vs-Spill-Bonneville-2000.pdf,Technical Report,2001-3,Adult Chinook Salmon And Steelhead Fallbacks Versus Spill At Bonneville Dam In 2000,"Bjornn, T.C.; Peery, C.A.; Jepson, M.A.; Tolotti, K.R.; Ringe, R.R.; Lee, S.R.",Idaho Cooperative Fish and Wildlife Research Unit,"Stuehrenberg, L.C.; Matter, A.","National Marine Fisheries Service, National Oceanic and Atmospheric Administration",University of Idaho,"U.S. Army Corps of Engineers, Portland District; U.S. Army Corps of Engineers, Walla Walla District",2001,"A randomized block test was conducted to evaluate effects of high and low spill on fallback rates of adult salmon and steelhead at Bonneville Dam in 2000. Periods of low spill (50-75 kcfs) were alternated with periods of high spill (80-145 kcfs) during which the proportion of Chinook salmon and steelhead that fell back were compared. Overall, 1,624 Chinook salmon and steelhead passed through the two fishways, of which 180 fish (11.1%) fell back at Bonneville Dam, and of those, 1,449 fish and 168 fall backs were used in the analysis. Percent fallback for salmon and steelhead that passed through both fishways averaged 9.5% (+ 2.45%) during the low-spill treatment and 13.5% (+ 3.7%) during the high-spill treatment. When fallbacks that occurred more than 24 h after fish first exited fishways and those fallbacks from fish that moved upstream at least as far at Cascade Locks, Oregon (2.5 km) before falling back were removed from analysis, percent fallback averaged 6.2% (+ 2.1%) during the low-spill treatment and 9.3% (+ 2.5%) during the high-spill treatment. Fish that passed the dam using the Bradford Island fishway averaged percent fallback of 14.9% (+ 3.9%) during the low-spill treatment and 20.6% (+ 4.9%) during high spill. When fallbacks from the Bradford Island fishway that occurred more than 24 h after fish first exited fishways and those fallbacks from fish that moved upstream before falling back were removed from analysis, percent fallback averaged 10.2% (+ 2.9%) during the low-spill treatment and 15.8% (+ 3.6%) during high spill, the only comparison with a significant difference in percent fallback between high and low-spill treatments. Percent of fish that fell back were not significantly related to spill in regression analysis, which contrasts with results of our analysis of fallback at Bonneville Dam from previous years. It appears that a component of the fallback that occurs at Bonneville Dam each year may be independent of spill level.","Steelhead, Oncorhynchus mykiss; Chinook salmon, Oncorhynchus tshawytscha",Columbia River; Bonneville Dam,salmonids; Federal Columbia River Power System; FCPRS; radiotelemetry; migration; fishways; experimental design; fallback rates; spill levels; passage behavior,"University of Idaho, Fish Ecology Research Lab",eng,?,?,application/pdf,Text
ferl-tr-2000-5,ferl-tr-2000-5.pdf,2000-05-CK-general-migration-1996.pdf,Technical Report,2000-5,"Migration Of Adult Spring And Summer Chinook Salmon Past Columbia And Snake River Dams, Through Reservoirs And Distribution Into Tributaries, 1996","Bjornn, T.C.;Keefer, M.L.; Peery, C.A.; Tolotti, K.R.; Ringe, R.R.; Keniry, P.J.",Idaho Cooperative Fish and Wildlife Research Unit,"Stuehrenberg, L.C.","National Marine Fisheries Service, National Oceanic and Atmospheric Administration",University of Idaho,"U.S. Army Corps of Engineers, Portland District; U.S. Army Corps of Engineers, Walla Walla District; Bonneville Power Administration",2000,"We captured 853 spring and summer Chinook salmon Oncorhynchus tshawytscha in the adult trapping facility at Bonneville Dam in 1996, released them with radio transmitters, and studied their passage past dams, through reservoirs and into tributaries. Radio receivers were set up at Columbia and Snake river dams and at the mouths of major tributaries to monitor movements of salmon. Recaptures of salmon at hatcheries, weirs and traps, and data from mobile tracking were used to complete the migration history.","Steelhead, Oncorhynchus mykiss; Chinook salmon, Oncorhynchus tshawytscha",Columbia River; Ice Harbor Dam; John Day Dam; Snake River,salmonids; Federal Columbia River Power System; FCPRS; radiotelemetry; migration; fishways; transition pools; passage behavior,"University of Idaho, Fish Ecology Research Lab",eng,?,?,application/pdf,Text
ferl-tr-2000-3,ferl-tr-2000-3.pdf,2000-03-John-Day-fallback-1996-1998.pdf,Technical Report,2000-3,"Adult Chinook And Sockeye Salmon, And Steelhead Fallback Rates At John Day Dam - 1996, 1997, And 1998","Bjornn, T.C.; Keefer, M.L.; Peery, C.A.; Tolotti, K.R.; Jepson, M.A.; Ringe, R.R.",Idaho Cooperative Fish and Wildlife Research Unit,"Stuehrenberg, L.C.","National Marine Fisheries Service, National Oceanic and Atmospheric Administration",University of Idaho,"U.S. Army Corps of Engineers, Portland District; U.S. Army Corps of Engineers, Walla Walla District; Bonneville Power Administration",2000,"We outfitted 853 spring and summer Chinook salmon Onchorhynchus tshawytscha with radio transmitters at Bonneville Dam in 1996, 1,016 in 1997, and 957 in 1998. We outfitted 577 sockeye salmon O. nerka in 1997, 770 steelhead O. mykiss in 1996, 975 steelhead in 1997, and 1,032 fall Chinook salmon in 1998. Of these, 1,564 spring and summer Chinook salmon, 410 fall Chinook salmon, 430 sockeye salmon, and 1,024 steelhead retained transmitters and were recorded passing John Day Dam via fishways. An additional 19 to 45 spring and summer Chinook salmon, 71 fall Chinook salmon, 38 sockeye salmon, and 17 to 23 steelhead were known to pass the dam, either via the navigation lock, during fishway antenna outages, or with malfunctioning or lost transmitters. We monitored passage and fallbacks at John Day Dam using antennas/receivers in the tailrace and fishways in all years and supplemented that data with recapture records, telemetry records from receivers at upriver dams and the mouths of tributaries, and locations of fish by mobile trackers.","Steelhead, Oncorhynchus mykiss; Chinook salmon, Oncorhynchus tshawytscha",Snake River; Ice Harbor Dam; John Day Dam; Columbia River,salmonids; Federal Columbia River Power System; FCPRS; radiotelemetry; migration; fishways; passage behavior; fallback rates,"University of Idaho, Fish Ecology Research Lab",eng,?,?,application/pdf,Text
ferl-tr-2000-2,ferl-tr-2000-2.pdf,2000-02-The-Dalles-fallback-1996-1998.pdf,Technical Report,2000-2,"Adult Chinook And Sockeye Salmon, And Steelhead Fallback Rates At The Dalles Dam - 1996, 1997, And 1998","Bjornn, T.C.; Keefer, M.L.; Peery, C.A.; Jepson, M.A.; Tolotti, K.R.; Ringe, R.R.",Idaho Cooperative Fish and Wildlife Research Unit,"Stuehrenberg, L.C.","National Marine Fisheries Service, National Oceanic and Atmospheric Administration",University of Idaho,"U.S. Army Corps of Engineers, Portland District; U.S. Army Corps of Engineers, Walla Walla District; Bonneville Power Administration",2000,"We outfitted 853 spring and summer Chinook salmon Onchorhynchus tshawytscha with radio transmitters at Bonneville Dam in 1996, 1,016 in 1997, and 957 in 1998. We outfitted 577 sockeye salmon O. nerka in 1997, 770 steelhead O. mykiss in 1996, 975 steelhead in 1997, and 1,032 fall Chinook salmon in 1998. Of these, 1,894 spring and summer Chinook salmon, 616 fall Chinook salmon, 485 sockeye salmon, and 1,219 steelhead retained transmitters and were recorded passing The Dalles Dam via fishways. An additional 1% to 3% were known to pass the dam, either via the navigation lock or during antenna outages. We monitored passage and fallbacks at The Dalles Dam using antennas/receivers in the tailrace and fishways in all years and supplemented that data with recapture records, telemetry records from receivers at upriver dams and the mouths of tributaries, and locations of fish by mobile trackers.","Steelhead, Oncorhynchus mykiss; Chinook salmon, Oncorhynchus tshawytscha; sockeye salmon, Oncorhynchus nerka",Bonneville Dam; The Dalles Dam; Columbia River; Snake River,salmonids; Federal Columbia River Power System; FCPRS; radiotelemetry; migration; fishways; passage behavior; fallback rates,"University of Idaho, Fish Ecology Research Lab",eng,?,?,application/pdf,Text
ferl-tr-2000-1,ferl-tr-2000-1.pdf,2000-01-Bonneville-Fallback-1996-1998.pdf,Technical Report,2000-1,"Adult Chinook And Sockeye Salmon, And Steelhead Fallback Rates At Bonneville Dam, - 1996-1998","Bjornn, T.C.; Keefer, M.L.; Peery, C.A.; Tolotti, K.R.; Ringe, R.R.",Idaho Cooperative Fish and Wildlife Research Unit,"Stuehrenberg, L.C.","National Marine Fisheries Service, National Oceanic and Atmospheric Administration",University of Idaho,"U.S. Army Corps of Engineers, Portland District; U.S. Army Corps of Engineers, Walla Walla District; Bonneville Power Administration",2000,"Starting in 1996, we outfitted large numbers of adult spring and summer Chinook salmon Onchorhynchus tshawytscha, sockeye salmon O. nerka, and steelhead O. mykiss with radio transmitters at Bonneville Dam to monitor their passage at the dam s in the Columbia and Snake rivers and survival to natal streams. In this report, we present information on the percentage of salmon and steelhead that fell back at Bonneville Dam, fallback rates (includes multiple fallbacks by individual fish), relations to environmental variables, survival of fish that fell back, and bias in escapement estimates based on counts of fish at the dams. I n the three years 1996, 1997, and 1998 we outfitted 2,825 spring and summer Chinook salmon with transmitters, 577 sockeye salmon in 1997, 1,745 steelhead with transmitters in 1996 and 1997, and 1,032 fall Chinook salmon in 1998. Of these, 3,605 Chinook salmon, 562 sockeye salmon, and 1,640 steelhead passed the dam after they were released 10 km downstream from the dam. We monitored passage and fallbacks at the dam using antennas and receivers in the tailrace, fishways, and forebay in all years, and supplemented that data with recapture records, teleme try records from receivers at upriver dams and the mouths of tributaries, and locations of fish found by tracking with antennas on truck or boats.","Steelhead, Oncorhynchus mykiss; Chinook salmon, Oncorhynchus tshawytscha; sockeye salmon, Oncorhynchus nerka",Bonneville Dam; Columbia River; Snake River,salmonids; Federal Columbia River Power System; FCPRS; radiotelemetry; migration; fishways; passage behavior; fallback rates,"University of Idaho, Fish Ecology Research Lab",eng,?,?,application/pdf,Text
